{
  "$schema": "../schemas/governed-events.schema.json",
  "schemaVersion": "1.0.0",
  "updatedAt": "2026-09-29",
  "coverage": {
    "mode": "PARTIAL_EXPLICIT",
    "from": "2026-09-25",
    "note": "Registro iniziale esplicito: non ricostruisce retroattivamente eventi non ancora registrati."
  },
  "events": [
    {
      "id": "EVT-CC2-F1E-MERGE-81",
      "eventType": "MERGE",
      "occurredAt": "2026-09-25T02:25:42Z",
      "label": "CC2-F1/E Project Knowledge integrata",
      "subjectRef": "CC2-F1/E",
      "sourceRef": "github:pull/81",
      "authority": "GitHub merge + HUMAN exact-head review",
      "versionRef": "4a17766bc315340824b4ef44204f81a1487515ce",
      "details": [
        "Project Knowledge & Agent Context Foundation integrata.",
        "ADR-015 resta PROPOSED."
      ]
    },
    {
      "id": "EVT-PENPOT-MCP-MERGE-82",
      "eventType": "MERGE",
      "occurredAt": "2026-09-25T02:31:39Z",
      "label": "Penpot MCP pilot refresh integrato",
      "subjectRef": "PENPOT-MCP-PILOT",
      "sourceRef": "github:pull/82",
      "authority": "GitHub merge + HUMAN exact-head review",
      "versionRef": "262b7e4c8b908f4d3c39e2469c0e9d34e03a4e25",
      "details": [
        "Pilot tooling separato dal runtime di prodotto.",
        "Nessuna nuova authority."
      ]
    },
    {
      "id": "EVT-PENPOT-DS-MERGE-83",
      "eventType": "MERGE",
      "occurredAt": "2026-09-25T02:36:59Z",
      "label": "TRAMA Penpot design system integrato",
      "subjectRef": "PENPOT-DESIGN-SYSTEM",
      "sourceRef": "github:pull/83",
      "authority": "GitHub merge + HUMAN exact-head review",
      "versionRef": "5cfb09f94ea532dc1f64523f7e10da6629159843",
      "details": [
        "Design system mobile-first e gate accessibilità integrati."
      ]
    },
    {
      "id": "EVT-CC2-F4-MERGE-84",
      "eventType": "MERGE",
      "occurredAt": "2026-09-25T02:58:23Z",
      "label": "CC2-F4 Capability + Ecosystem Map integrata",
      "subjectRef": "CC2-F4",
      "sourceRef": "github:pull/84",
      "authority": "GitHub merge + HUMAN exact-head review",
      "versionRef": "93a3fadf78732979c4536cbb394744b9471e14da",
      "details": [
        "Capability projection conservativa.",
        "Nessun edge sintetico fuori dallo snapshot."
      ]
    },
    {
      "id": "EVT-PR70-SUPERSEDED",
      "eventType": "SUPERSESSION",
      "occurredAt": "2026-09-25T03:10:52Z",
      "label": "PR #70 superseded da #81",
      "subjectRef": "github:pull/70",
      "sourceRef": "github:pull/70",
      "authority": "TRAMA housekeeping",
      "versionRef": "4a17766bc315340824b4ef44204f81a1487515ce",
      "details": [
        "Salvage/history source conservata; nessun merge dalla branch stale."
      ]
    },
    {
      "id": "EVT-PR78-SUPERSEDED",
      "eventType": "SUPERSESSION",
      "occurredAt": "2026-09-25T03:10:56Z",
      "label": "PR #78 superseded da #82",
      "subjectRef": "github:pull/78",
      "sourceRef": "github:pull/78",
      "authority": "TRAMA housekeeping",
      "versionRef": "262b7e4c8b908f4d3c39e2469c0e9d34e03a4e25",
      "details": [
        "Salvage/history source conservata; nessun merge dalla branch stale."
      ]
    },
    {
      "id": "EVT-PR79-SUPERSEDED",
      "eventType": "SUPERSESSION",
      "occurredAt": "2026-09-25T03:10:59Z",
      "label": "PR #79 superseded da #83",
      "subjectRef": "github:pull/79",
      "sourceRef": "github:pull/79",
      "authority": "TRAMA housekeeping",
      "versionRef": "5cfb09f94ea532dc1f64523f7e10da6629159843",
      "details": [
        "Salvage/history source conservata; nessun merge dalla branch stale."
      ]
    },
    {
      "id": "EVT-CC2-F5-MERGE-85",
      "eventType": "MERGE",
      "occurredAt": "2026-09-25T03:14:33Z",
      "label": "CC2-F5 Evidence Explorer + Integrity integrata",
      "subjectRef": "CC2-F5",
      "sourceRef": "github:pull/85",
      "authority": "GitHub merge + HUMAN exact-head review",
      "versionRef": "21c43b3e092c3dc31e450d2c9b2e3bf24b8238fd",
      "details": [
        "Integrity checks PASS / ISSUE / NOT_EVALUABLE.",
        "Nessun overall score."
      ]
    },
    {
      "id": "EVT-CC2-F6-MERGE-86",
      "eventType": "MERGE",
      "occurredAt": "2026-09-25T03:29:48Z",
      "label": "CC2-F6 Timeline + Operational Path integrata",
      "subjectRef": "CC2-F6",
      "sourceRef": "github:pull/86",
      "authority": "GitHub merge + HUMAN exact-head review",
      "versionRef": "f3c4396a620e2b4c51beb3f2616ebeebf82a6342",
      "details": [
        "Primo ciclo CC2-F0–F6 completato.",
        "Timeline semantica a copertura PARTIAL_EXPLICIT; Operational Path derivato da fonti governate."
      ]
    },
    {
      "id": "EVT-CC3-F0-MERGE-88",
      "eventType": "MERGE",
      "occurredAt": "2026-09-25T03:49:30Z",
      "label": "CC3-F0 Forecast Contract & Guardrails integrata",
      "subjectRef": "CC3-F0",
      "sourceRef": "github:pull/88",
      "authority": "GitHub merge + HUMAN exact-head review",
      "versionRef": "cfbec2f2aa806537d70a8c7ed885212bceff97cd",
      "details": [
        "Exact head 49c98322ac5f3bd8cfed9091034362b87d80ea1a autorizzato con HUMAN EXACT-HEAD REVIEW PASS.",
        "Forecast contract e guardrail integrati; F1–F5 non autorizzati dal merge F0.",
        "ADR-016 resta PROPOSED; nessuna authority o runtime authorization introdotta."
      ]
    },
    {
      "id": "EVT-R3-F0-S3V2-MERGE-32",
      "eventType": "MERGE",
      "occurredAt": "2026-09-25T04:19:33Z",
      "label": "R3-F0/S3-V2 Atlas Product Experience chiusa",
      "subjectRef": "R3-F0",
      "sourceRef": "github:Curriculum-Atlas/pull/32",
      "authority": "Atlas merge + HUMAN exact-head review",
      "versionRef": "423444be9dd883f4c35c6c1c89e94f6b0e5405fa",
      "details": [
        "Exact head bc11577eeeeeed9c43ad62ac43fb7561e1197246 validato con F4 Mobile/LIM, F5 Exit e TRAMA Perceptible Write PASS.",
        "S3-V2 chiusa; R3-F0 exit gate soddisfatto.",
        "Nessuna autorizzazione a R3-P4, DOS-A1 o runtime Docente OS → Atlas."
      ]
    },
    {
      "id": "EVT-ECO02-P1-FINAL-HUMAN-PASS",
      "eventType": "HUMAN_REVIEW",
      "occurredAt": "2026-09-25T12:46:47Z",
      "label": "ECO-02/P1 chiuso con accettazione umana finale",
      "subjectRef": "ECO-02-P1",
      "sourceRef": "docs/pilots/ECO-02-P1-FINAL-HUMAN-ACCEPTANCE-2026-09-25.md",
      "authority": "TRAMA / Human Review",
      "versionRef": "02cfe7accee9abe63dc7c7d936ce1f3e0b7b8d7d",
      "details": [
        "CLOSED_VERIFIED / HUMAN REVIEW PASS.",
        "Caso reale docente concluso senza riaprire DOS-A1.",
        "La chiusura non autorizza nuovo runtime cross-product."
      ]
    },
    {
      "id": "EVT-CC3-F1-HUMAN-PASS",
      "eventType": "HUMAN_REVIEW",
      "occurredAt": "2026-09-26T00:00:00Z",
      "label": "CC3-F1 Next Transition Engine chiuso con Human Review PASS",
      "subjectRef": "CC3-F1",
      "sourceRef": "docs/reviews/CC3-F1-HUMAN-REVIEW-2026-09-26.md",
      "authority": "TRAMA / Human Review",
      "versionRef": "686fe01b91b5e5b38a9956198e79c5ff713b0b8f",
      "details": [
        "GATE-CC3-F1-HUMAN PASS.",
        "Motore deterministico e read-only confermato.",
        "Nessuna probabilità, ranking, auto-promotion o runtime authorization."
      ]
    }
  ]
}
